{
  "$schema": "https://json-schema.org/draft/2020-12/schema",
  "type": "object",
  "additionalProperties": false,
  "required": [
    "schema_version",
    "dataset_id",
    "release",
    "purpose",
    "state",
    "frozen_at",
    "catalog",
    "cases",
    "labels",
    "related_locks",
    "evidence",
    "derivation",
    "unicode_version",
    "qualification_evidence_ids",
    "digest"
  ],
  "properties": {
    "schema_version": {
      "type": "integer",
      "const": 1
    },
    "dataset_id": {
      "type": "string",
      "minLength": 1,
      "maxLength": 256,
      "x-maxBytes": 256
    },
    "release": {
      "type": "integer",
      "minimum": 1
    },
    "purpose": {
      "enum": [
        "fixture",
        "development",
        "acceptance"
      ]
    },
    "state": {
      "enum": [
        "provisional",
        "frozen"
      ]
    },
    "frozen_at": {
      "anyOf": [
        {
          "type": "string",
          "pattern": "^\\d{4}-\\d{2}-\\d{2}T\\d{2}:\\d{2}:\\d{2}(?:\\.\\d+)?Z$(?![\\s\\S])",
          "x-utc": true
        },
        {
          "type": "null"
        }
      ]
    },
    "catalog": {
      "type": "object",
      "additionalProperties": false,
      "required": [
        "path",
        "digest"
      ],
      "properties": {
        "path": {
          "type": "string",
          "minLength": 1,
          "maxLength": 2048,
          "x-maxBytes": 2048
        },
        "digest": {
          "type": "string",
          "pattern": "^[0-9a-f]{64}$(?![\\s\\S])"
        }
      }
    },
    "cases": {
      "type": "object",
      "additionalProperties": false,
      "required": [
        "path",
        "digest"
      ],
      "properties": {
        "path": {
          "type": "string",
          "minLength": 1,
          "maxLength": 2048,
          "x-maxBytes": 2048
        },
        "digest": {
          "type": "string",
          "pattern": "^[0-9a-f]{64}$(?![\\s\\S])"
        }
      }
    },
    "labels": {
      "type": "object",
      "additionalProperties": false,
      "required": [
        "path",
        "digest"
      ],
      "properties": {
        "path": {
          "type": "string",
          "minLength": 1,
          "maxLength": 2048,
          "x-maxBytes": 2048
        },
        "digest": {
          "type": "string",
          "pattern": "^[0-9a-f]{64}$(?![\\s\\S])"
        }
      }
    },
    "related_locks": {
      "type": "array",
      "items": {
        "type": "object",
        "additionalProperties": false,
        "required": [
          "id",
          "path",
          "digest"
        ],
        "properties": {
          "id": {
            "type": "string",
            "minLength": 1,
            "maxLength": 256,
            "x-maxBytes": 256
          },
          "path": {
            "type": "string",
            "minLength": 1,
            "maxLength": 2048,
            "x-maxBytes": 2048
          },
          "digest": {
            "type": "string",
            "pattern": "^[0-9a-f]{64}$(?![\\s\\S])"
          }
        }
      },
      "maxItems": 10000
    },
    "evidence": {
      "type": "array",
      "items": {
        "type": "object",
        "additionalProperties": false,
        "required": [
          "id",
          "sha256",
          "bytes"
        ],
        "properties": {
          "id": {
            "type": "string",
            "minLength": 1,
            "maxLength": 256,
            "x-maxBytes": 256
          },
          "sha256": {
            "type": "string",
            "pattern": "^[0-9a-f]{64}$(?![\\s\\S])"
          },
          "bytes": {
            "type": "integer",
            "minimum": 0
          }
        }
      },
      "maxItems": 10000
    },
    "derivation": {
      "type": "object",
      "additionalProperties": false,
      "required": [
        "revision",
        "config_digest",
        "evidence_ids"
      ],
      "properties": {
        "revision": {
          "type": "string",
          "minLength": 1,
          "maxLength": 256,
          "x-maxBytes": 256
        },
        "config_digest": {
          "type": "string",
          "pattern": "^[0-9a-f]{64}$(?![\\s\\S])"
        },
        "evidence_ids": {
          "type": "array",
          "items": {
            "type": "string",
            "minLength": 1,
            "maxLength": 256,
            "x-maxBytes": 256
          },
          "uniqueItems": true,
          "x-sorted": true
        }
      }
    },
    "unicode_version": {
      "type": "string",
      "minLength": 1,
      "maxLength": 256,
      "x-maxBytes": 256
    },
    "qualification_evidence_ids": {
      "type": "array",
      "items": {
        "type": "string",
        "minLength": 1,
        "maxLength": 256,
        "x-maxBytes": 256
      },
      "uniqueItems": true,
      "x-sorted": true
    },
    "digest": {
      "type": "string",
      "pattern": "^[0-9a-f]{64}$(?![\\s\\S])"
    }
  }
}
